{
  "schema_version": "1",
  "run_id": "004",
  "task_slug": "lint-gate-remediation",
  "sender": "unit-test-agent",
  "receiver": "orchestrator-agent",
  "completed_at": "2026-03-23T01:59:55Z",
  "overall_status": "green",
  "coverage_summary": {
    "total_pct": 99.61,
    "threshold_pct": 85,
    "modules_below_threshold": []
  },
  "files_created_or_modified": [
    "tests/test_services/test_account_service.py",
    "tests/test_api/test_accounts.py",
    "tests/test_repository/test_cosmos_account_repository.py"
  ],
  "notes": "Run-004 testing completed with targeted account/repository/API regressions and full suite gate: 292 passed, coverage 99.61%."
}