{
  "schema_version": "1",
  "run_id": "002",
  "task_slug": "email-bank-statement",
  "sender": "unit-test-agent",
  "receiver": "orchestrator-agent",
  "completed_at": "2026-03-20T02:56:11Z",
  "overall_status": "green",
  "coverage_summary": {
    "total_pct": 97.14,
    "threshold_pct": 85,
    "modules_below_threshold": []
  },
  "files_created_or_modified": [
    "tests/test_models/test_statement.py",
    "tests/test_services/test_statement_service.py",
    "tests/test_api/test_statements.py",
    "tests/test_main.py"
  ],
  "notes": "Test run command: pytest tests/ --cov=src --cov-report=term-missing --cov-fail-under=85. Result: 272 passed, 0 failed, coverage threshold met. Total coverage 97.14%."
}