{
  "schema_version": "1",
  "run_id": "003",
  "task_slug": "quality-gates-remediation",
  "sender": "unit-test-agent",
  "receiver": "orchestrator-agent",
  "completed_at": "2026-03-20T05:31:13Z",
  "overall_status": "green",
  "coverage_summary": {
    "total_pct": 97.4,
    "threshold_pct": 85,
    "modules_below_threshold": []
  },
  "files_created_or_modified": [
    "tests/test_main.py",
    "tests/test_services/test_statement_service.py"
  ],
  "notes": "Focused run passed (38 tests on updated files). Full gate run passed: pytest tests/ --cov=src --cov-report=term-missing --cov-fail-under=85 with 97.40% coverage."
}