{
  "schema_version": "1",
  "run_id": "001",
  "task_slug": "add-transfer-api",
  "sender": "unit-test-agent",
  "receiver": "orchestrator-agent",
  "completed_at": "2026-03-19T11:45:00Z",
  "overall_status": "green",
  "coverage_summary": {
    "total_pct": 91.2,
    "threshold_pct": 85,
    "modules_below_threshold": []
  },
  "failing_tests": [],
  "files_created_or_modified": [
    "tests/test_services/test_account_service.py",
    "tests/test_api/test_accounts.py",
    "tests/test_exceptions/test_domain_exceptions.py",
    "tests/test_repository/test_cosmos_transfer_repository.py"
  ],
  "notes": "All 47 tests pass. New transfer tests cover happy path, insufficient funds (422), source not found (404), destination not found (404), and Cosmos SDK error propagation. Coverage: src/services/account_service.py=93%, src/api/accounts.py=89%, src/repository/cosmos_transfer_repository.py=88%."
}
